{
  "schema": "agent-harness/manifest.v1",
  "domain": "loop-library",
  "skill_count": 1,
  "loop_defaults": {
    "max_attempts_per_task": 3,
    "max_loop_iterations": 12,
    "escalate_on": [
      "attempts_exhausted",
      "no_verification_available",
      "destructive_or_irreversible_action",
      "goal_drift_detected"
    ]
  },
  "skills": [
    {
      "name": "loop-library",
      "path": "loop-library",
      "description": "Discover, find, compare, audit, repair, adapt, and design repeatable AI-agent loops with explicit triggers, actions, verification, stopping conditions, guardrails, and handoffs. Use when a user asks to analyze a codebase for potential loops, mine coding-thread history for work done more than once, turn repeated engineering work into a loop, find or recommend a published loop, create a recurring agent workflow or automation cadence, turn an outcome into a bounded copy-ready loop, or review an existing loop for weak checks, unsafe authority, unbounded repetition, stale state, or unclear stopping",
      "tools": [],
      "agentic_signals": {
        "goal_intake": false,
        "refusal_gate": false,
        "verification": true,
        "loop_discipline": true,
        "close_out": true
      },
      "references": [
        "audit.md",
        "discover.md"
      ]
    }
  ]
}
